record_id,original_hisco,enhanced_input,original_occupation,sex,county,count
535,37020,"Male clerk in meteorological office in London (Parts Of Middlesex, ",clerk in meteorological office,Male,"London (Parts Of Middlesex, ",1
536,37020,"Male late travelling sorter gpo superannuated in London (Parts Of Middlesex, ",late travelling sorter gpo superannuated,Male,"London (Parts Of Middlesex, ",1
537,37020,"Male masters clerk central office royal courts of justice in London (Parts Of Middlesex, ",masters clerk central office royal courts of justice,Male,"London (Parts Of Middlesex, ",1
538,37020,"Male private enquiry office gnrly in London (Parts Of Middlesex, ",private enquiry office gnrly,Male,"London (Parts Of Middlesex, ",1
539,37020,"Male retired surveyor of taxes in London (Parts Of Middlesex, ",retired surveyor of taxes,Male,"London (Parts Of Middlesex, ",1
540,20200,"Male civil service regents pk constable in London (Parts Of Middlesex, ",civil service regents pk constable,Male,"London (Parts Of Middlesex, ",1
541,58220,"Male police inspector supernumerary in London (Parts Of Middlesex, ",police inspector supernumerary,Male,"London (Parts Of Middlesex, ",1
542,58900,"Male inspector of goods dept rly in London (Parts Of Middlesex, ",inspector of goods dept rly,Male,"London (Parts Of Middlesex, ",1
543,58900,"Male rate and tax collector clerk in London (Parts Of Middlesex, ",rate and tax collector clerk,Male,"London (Parts Of Middlesex, ",1
544,31090,"Male schoolmaster wes local preacher in London (Parts Of Middlesex, ",schoolmaster wes local preacher,Male,"London (Parts Of Middlesex, ",1
545,58420,"Male retired staff vety surgeon list madras army in London (Parts Of Middlesex, ",retired staff vety surgeon list madras army,Male,"London (Parts Of Middlesex, ",1
546,58420,"Male retired surgeon major lst in London (Parts Of Middlesex, ",retired surgeon major lst,Male,"London (Parts Of Middlesex, ",1
547,58430,"Male late captn kings own light infantry militia in London (Parts Of Middlesex, ",late captn kings own light infantry militia,Male,"London (Parts Of Middlesex, ",1
548,58430,"Male captain r n retired in London (Parts Of Middlesex, ",captain r n retired,Male,"London (Parts Of Middlesex, ",1
549,58420,"Male superintendent of police in London (Parts Of Middlesex, ",superintendent of police,Male,"London (Parts Of Middlesex, ",1
550,39340,"Male assistant clerk in a law office in London (Parts Of Middlesex, ",assistant clerk in a law office,Male,"London (Parts Of Middlesex, ",1
551,13100,"Male undergraduate of the university of london in London (Parts Of Middlesex, ",undergraduate of the university of london,Male,"London (Parts Of Middlesex, ",1
552,59990,"Male billard marker barman in London (Parts Of Middlesex, ",billard marker barman,Male,"London (Parts Of Middlesex, ",1
553,64990,"Male assistant keeper of the gyts in London (Parts Of Middlesex, ",assistant keeper of the gyts,Male,"London (Parts Of Middlesex, ",1
554,43090,"Male commercial traveller in London (Parts Of Middlesex, ",commercial traveller,Male,"London (Parts Of Middlesex, ",1
555,39310,"Male chelsea pensioner clerk in London (Parts Of Middlesex, ",chelsea pensioner clerk,Male,"London (Parts Of Middlesex, ",1
556,39310,"Male clerk at contractors in London (Parts Of Middlesex, ",clerk at contractors,Male,"London (Parts Of Middlesex, ",1
557,98300,"Male engine driver to builder in London (Parts Of Middlesex, ",engine driver to builder,Male,"London (Parts Of Middlesex, ",1
558,98490,"Male laborer carriage cleaner in London (Parts Of Middlesex, ",laborer carriage cleaner,Male,"London (Parts Of Middlesex, ",1
559,41010,"Male sheriffs man in London (Parts Of Middlesex, ",sheriffs man,Male,"London (Parts Of Middlesex, ",1
560,98550,"Male omnibus cleaner in London (Parts Of Middlesex, ",omnibus cleaner,Male,"London (Parts Of Middlesex, ",1
561,98550,"Male boy bookseller men in London (Parts Of Middlesex, ",boy bookseller men,Male,"London (Parts Of Middlesex, ",1
562,4290,"Male bricklayer in London (Parts Of Middlesex, ",bricklayer,Male,"London (Parts Of Middlesex, ",1
563,37040,"Male boy boy newspaper errand in London (Parts Of Middlesex, ",boy boy newspaper errand,Male,"London (Parts Of Middlesex, ",1
564,37040,"Male boy errand fisherman in London (Parts Of Middlesex, ",boy errand fisherman,Male,"London (Parts Of Middlesex, ",1
565,83230,"Male apprentice house furnishers cabt maker in London (Parts Of Middlesex, ",apprentice house furnishers cabt maker,Male,"London (Parts Of Middlesex, ",1
566,85100,"Male electricion in London (Parts Of Middlesex, ",electricion,Male,"London (Parts Of Middlesex, ",1
567,83830,"Male machine turner eng in London (Parts Of Middlesex, ",machine turner eng,Male,"London (Parts Of Middlesex, ",1
568,72000,"Male labourer tank work iron in London (Parts Of Middlesex, ",labourer tank work iron,Male,"London (Parts Of Middlesex, ",1
569,81300,"Male carriage spring maker coachmaker mkr in London (Parts Of Middlesex, ",carriage spring maker coachmaker mkr,Male,"London (Parts Of Middlesex, ",1
570,21230,"Male master builder m boys in London (Parts Of Middlesex, ",master builder m boys,Male,"London (Parts Of Middlesex, ",1
571,95410,"Male apprentice to carpenter and joiner in London (Parts Of Middlesex, ",apprentice to carpenter and joiner,Male,"London (Parts Of Middlesex, ",1
572,93120,"Male house decr employing men in London (Parts Of Middlesex, ",house decr employing men,Male,"London (Parts Of Middlesex, ",1
573,81190,"Male chair couch manufr in London (Parts Of Middlesex, ",chair couch manufr,Male,"London (Parts Of Middlesex, ",1
574,63290,"Male cork cutter in London (Parts Of Middlesex, ",cork cutter,Male,"London (Parts Of Middlesex, ",1
575,63290,"Male underclothing cutter dressmaker in London (Parts Of Middlesex, ",underclothing cutter dressmaker,Male,"London (Parts Of Middlesex, ",1
576,89300,"Male labourer brick layer in London (Parts Of Middlesex, ",labourer brick layer,Male,"London (Parts Of Middlesex, ",1
577,80390,"Male carpenter staircase handrail maker in London (Parts Of Middlesex, ",carpenter staircase handrail maker,Male,"London (Parts Of Middlesex, ",1
578,80390,"Male matchmaker bryant m fusee in London (Parts Of Middlesex, ",matchmaker bryant m fusee,Male,"London (Parts Of Middlesex, ",1
579,80390,"Male rectifier parchment maker in London (Parts Of Middlesex, ",rectifier parchment maker,Male,"London (Parts Of Middlesex, ",1
580,94290,"Male apprentice brush maker in London (Parts Of Middlesex, ",apprentice brush maker,Male,"London (Parts Of Middlesex, ",1
581,41010,"Male boy stationer employing girls in London (Parts Of Middlesex, ",boy stationer employing girls,Male,"London (Parts Of Middlesex, ",1
582,92400,"Male artists lithographer in London (Parts Of Middlesex, ",artists lithographer,Male,"London (Parts Of Middlesex, ",1
583,92600,"Male book binder in London (Parts Of Middlesex, ",book binder,Male,"London (Parts Of Middlesex, ",1
584,75500,"Male table maker out of work in London (Parts Of Middlesex, ",table maker out of work,Male,"London (Parts Of Middlesex, ",1
585,79990,"Male braid maker trimmings in London (Parts Of Middlesex, ",braid maker trimmings,Male,"London (Parts Of Middlesex, ",1
586,79330,"Male hat maker hatter in London (Parts Of Middlesex, ",hat maker hatter,Male,"London (Parts Of Middlesex, ",1
587,79590,"Male hat manufacture in London (Parts Of Middlesex, ",hat manufacture,Male,"London (Parts Of Middlesex, ",1
588,77650,"Male packer in London (Parts Of Middlesex, ",packer,Male,"London (Parts Of Middlesex, ",1
589,61220,"Male tea sampler in London (Parts Of Middlesex, ",tea sampler,Male,"London (Parts Of Middlesex, ",1
590,41010,"Male tobacconist and letter carrier in London (Parts Of Middlesex, ",tobacconist and letter carrier,Male,"London (Parts Of Middlesex, ",1
591,53220,"Male potman waiter unemployed in London (Parts Of Middlesex, ",potman waiter unemployed,Male,"London (Parts Of Middlesex, ",1
592,41010,"Male wine merchant wholesale in London (Parts Of Middlesex, ",wine merchant wholesale,Male,"London (Parts Of Middlesex, ",1
593,92900,"Male cartridge maker in r arsenal in London (Parts Of Middlesex, ",cartridge maker in r arsenal,Male,"London (Parts Of Middlesex, ",1
594,49020,"Male unemployed broker in London (Parts Of Middlesex, ",unemployed broker,Male,"London (Parts Of Middlesex, ",1
595,83400,"Male boy machinist messenger in London (Parts Of Middlesex, ",boy machinist messenger,Male,"London (Parts Of Middlesex, ",1
596,99999,"Male retired manager of braid trimming business in London (Parts Of Middlesex, ",retired manager of braid trimming business,Male,"London (Parts Of Middlesex, ",1
597,99999,"Male pensioner attendant on gentleman in London (Parts Of Middlesex, ",pensioner attendant on gentleman,Male,"London (Parts Of Middlesex, ",1
598,-1,"Male dressmaker in London (Parts Of Middlesex, ",dressmaker,Male,"London (Parts Of Middlesex, ",1
599,-1,"Male maartist in London (Parts Of Middlesex, ",maartist,Male,"London (Parts Of Middlesex, ",1
600,-1,"Male upholsterer in London (Parts Of Middlesex, ",upholsterer,Male,"London (Parts Of Middlesex, ",1
601,95410,"Unknown joiner in London (Parts Of Middlesex, ",joiner,Unknown,"London (Parts Of Middlesex, ",1
602,21194,Male bookseller in Merionethshire,bookseller,Male,Merionethshire,10
603,62110,Male agricultural labourer in Merionethshire,agricultural labourer,Male,Merionethshire,3
604,62430,Male farm servant shepherd in Merionethshire,farm servant shepherd,Male,Merionethshire,2
605,54020,Female assistant housekeeper in Merionethshire,assistant housekeeper,Female,Merionethshire,1
606,99999,Female shop man wife in Merionethshire,shop man wife,Female,Merionethshire,1
607,17120,Male bachelor of arts teacher in Merionethshire,bachelor of arts teacher,Male,Merionethshire,1
608,41010,Female retired grocer in Middlesex (Extra London),retired grocer,Female,Middlesex (Extra London),11
609,62110,Male field laborer in Middlesex (Extra London),field laborer,Male,Middlesex (Extra London),4
610,54020,Female domestic servant in Middlesex (Extra London),domestic servant,Female,Middlesex (Extra London),3
611,58900,Female pt income in Middlesex (Extra London),pt income,Female,Middlesex (Extra London),2
612,55100,Female caretaker of house in Middlesex (Extra London),caretaker of house,Female,Middlesex (Extra London),2
613,41010,Male unemployed tea trade in Middlesex (Extra London),unemployed tea trade,Male,Middlesex (Extra London),2
614,37020,Female postboy office draper in Middlesex (Extra London),postboy office draper,Female,Middlesex (Extra London),1
615,99999,Female housekeeper wife in Middlesex (Extra London),housekeeper wife,Female,Middlesex (Extra London),1
616,99999,Female cotton brokers daughter in Middlesex (Extra London),cotton brokers daughter,Female,Middlesex (Extra London),1
617,31090,Male retired watch maker registrar of births and deaths in Middlesex (Extra London),retired watch maker registrar of births and deaths,Male,Middlesex (Extra London),1
618,13100,Male professor in the french language in Middlesex (Extra London),professor in the french language,Male,Middlesex (Extra London),1
619,4250,Male apprentice seaman in Middlesex (Extra London),apprentice seaman,Male,Middlesex (Extra London),1
620,21140,Male copper agent in Middlesex (Extra London),copper agent,Male,Middlesex (Extra London),1
621,83210,Male tool maker machine in Middlesex (Extra London),tool maker machine,Male,Middlesex (Extra London),1
622,94290,Male master basket maker employing men boys in Middlesex (Extra London),master basket maker employing men boys,Male,Middlesex (Extra London),1
623,41010,Male cattle dealer in Middlesex (Extra London),cattle dealer,Male,Middlesex (Extra London),1
624,77400,Male tripe dresser dlr provis in Middlesex (Extra London),tripe dresser dlr provis,Male,Middlesex (Extra London),1
625,13200,Male tutor in Monmouthshire,tutor,Male,Monmouthshire,2
626,22190,Female mangler in Monmouthshire,mangler,Female,Monmouthshire,1
627,99999,Female horsekeeper wife in Monmouthshire,horsekeeper wife,Female,Monmouthshire,1
628,12900,Male accountant solicitors clerk in Monmouthshire,accountant solicitors clerk,Male,Monmouthshire,1
629,51020,Male retired licensed victualler in Monmouthshire,retired licensed victualler,Male,Monmouthshire,1
630,99999,Male fr son in Monmouthshire,fr son,Male,Monmouthshire,1
631,61400,Male farm servant indoor in Montgomeryshire,farm servant indoor,Male,Montgomeryshire,25
632,53101,Female domestic cook in Montgomeryshire,domestic cook,Female,Montgomeryshire,4
633,14120,Male gentlemans servant dom in Montgomeryshire,gentlemans servant dom,Male,Montgomeryshire,3
634,53220,Female hotel waitress domestic servant in Montgomeryshire,hotel waitress domestic servant,Female,Montgomeryshire,1
635,99999,Female blacksmith daughter in Montgomeryshire,blacksmith daughter,Female,Montgomeryshire,1
636,14120,Male vicar of llanfair ce ba in Montgomeryshire,vicar of llanfair ce ba,Male,Montgomeryshire,1
637,61110,Male farmer of acres employing labourer in Montgomeryshire,farmer of acres employing labourer,Male,Montgomeryshire,1
638,61400,Male farm bailiff domestic in Montgomeryshire,farm bailiff domestic,Male,Montgomeryshire,1
639,79990,Female maltster in Norfolk,maltster,Female,Norfolk,71
640,55240,Male sweep in Norfolk,sweep,Male,Norfolk,23
641,62430,Male shepherd in Norfolk,shepherd,Male,Norfolk,11
642,71120,Female box maker in Norfolk,box maker,Female,Norfolk,4
643,62110,Male retired farm servant in Norfolk,retired farm servant,Male,Norfolk,3
644,99999,Male infirm in Norfolk,infirm,Male,Norfolk,3
645,54020,Female housekeeper domestic servant in Norfolk,housekeeper domestic servant,Female,Norfolk,2
646,62110,Female worker farm servant in Norfolk,worker farm servant,Female,Norfolk,2
647,61110,Male boy farmer of acres employing men in Norfolk,boy farmer of acres employing men,Male,Norfolk,2
648,62113,Male farmer grocer son in Norfolk,farmer grocer son,Male,Norfolk,2
649,41010,Female assist to a linen draper in Norfolk,assist to a linen draper,Female,Norfolk,1
650,99999,Female twine spinners wife in Norfolk,twine spinners wife,Female,Norfolk,1
651,99999,Female parish road labourer man wife in Norfolk,parish road labourer man wife,Female,Norfolk,1
652,4250,Male seaman mcht svce in Norfolk,seaman mcht svce,Male,Norfolk,1
653,61110,Male farmer acres men in Norfolk,farmer acres men,Male,Norfolk,1
654,84130,Male apprentice fitter engineers in Norfolk,apprentice fitter engineers,Male,Norfolk,1
655,74500,Male laborer in cake oil mills in Norfolk,laborer in cake oil mills,Male,Norfolk,1
656,73300,Male works at paper miller in Norfolk,works at paper miller,Male,Norfolk,1
657,80100,Male pressman in shoe factory in Norfolk,pressman in shoe factory,Male,Norfolk,1
658,45220,Male hawker son in Norfolk,hawker son,Male,Norfolk,1
659,51020,Male innkeeper in Northamptonshire,innkeeper,Male,Northamptonshire,77
660,99999,Female house painter wife in Northamptonshire,house painter wife,Female,Northamptonshire,3
661,61400,Male labourer foreman farm bailiff in Northamptonshire,labourer foreman farm bailiff,Male,Northamptonshire,3
662,61400,Male estate laborer farm in Northamptonshire,estate laborer farm,Male,Northamptonshire,2
663,84220,Male retired watch maker in Northamptonshire,retired watch maker,Male,Northamptonshire,2
664,41010,Male retired grocer in Northamptonshire,retired grocer,Male,Northamptonshire,2
665,14120,Female family servant cook in Northamptonshire,family servant cook,Female,Northamptonshire,1
666,62113,Female farmer of acres lime burner wife in Northamptonshire,farmer of acres lime burner wife,Female,Northamptonshire,1
667,41010,Female machinist shoes in Northamptonshire,machinist shoes,Female,Northamptonshire,1
668,99999,Female agricultural scholar in Northamptonshire,agricultural scholar,Female,Northamptonshire,1
669,99999,Female formerly miller wife in Northamptonshire,formerly miller wife,Female,Northamptonshire,1
670,61110,Male farmer of acres employing man in Northamptonshire,farmer of acres employing man,Male,Northamptonshire,1
671,71120,Male laborer ironstone miner in Northamptonshire,laborer ironstone miner,Male,Northamptonshire,1
672,76140,Male leather cutter in Northamptonshire,leather cutter,Male,Northamptonshire,1
673,41010,Male baker grazier in Northamptonshire,baker grazier,Male,Northamptonshire,1
674,99130,Male late painters labourer in Northamptonshire,late painters labourer,Male,Northamptonshire,1
675,62110,Male agricultural labourer in Northumberland,agricultural labourer,Male,Northumberland,44
676,62110,Female agricultural labourer in Northumberland,agricultural labourer,Female,Northumberland,35
677,72400,Male apprentice iron moulder in Northumberland,apprentice iron moulder,Male,Northumberland,4
678,77100,Female miller in Northumberland,miller,Female,Northumberland,3
679,61110,Male farmer acres in Northumberland,farmer acres,Male,Northumberland,3
680,62110,Female farm servant out door in Northumberland,farm servant out door,Female,Northumberland,2
681,98130,Male waterman on steam boatman in Northumberland,waterman on steam boatman,Male,Northumberland,2
682,71120,Male miner lead ore dresser in Northumberland,miner lead ore dresser,Male,Northumberland,2
683,83400,Male model maker at engine works in Northumberland,model maker at engine works,Male,Northumberland,2
684,14120,Female wesleyan ministers daughter in Northumberland,wesleyan ministers daughter,Female,Northumberland,1
685,54010,Female acting as servant in Northumberland,acting as servant,Female,Northumberland,1
686,99999,Female solicitors managing clerk wife in Northumberland,solicitors managing clerk wife,Female,Northumberland,1
687,41010,Male fisherman merchant in Northumberland,fisherman merchant,Male,Northumberland,1
688,41010,Male horse shoer blacksmith in Northumberland,horse shoer blacksmith,Male,Northumberland,1
689,98590,Male deputy overman in a coal pit in Northumberland,deputy overman in a coal pit,Male,Northumberland,1
690,4250,Male boatswain seamen in Northumberland,boatswain seamen,Male,Northumberland,1
691,37040,Male messageboy in Northumberland,messageboy,Male,Northumberland,1
692,45190,Male travelling steam thresher agricultural labourer in Northumberland,travelling steam thresher agricultural labourer,Male,Northumberland,1
693,71130,Male quarreyman in Northumberland,quarreyman,Male,Northumberland,1
694,99999,Male blacksmith son in Northumberland,blacksmith son,Male,Northumberland,1
695,99999,Male pauper in Northumberland,pauper,Male,Northumberland,1
696,41010,Male coal merchant in Nottinghamshire,coal merchant,Male,Nottinghamshire,35
697,77310,Male apprentice butcher in Nottinghamshire,apprentice butcher,Male,Nottinghamshire,11
698,83230,Male pattern maker in Nottinghamshire,pattern maker,Male,Nottinghamshire,8
699,54020,Female kitchen maid domestic domestic servant in Nottinghamshire,kitchen maid domestic domestic servant,Female,Nottinghamshire,6
700,57020,Female hairdresser in Nottinghamshire,hairdresser,Female,Nottinghamshire,3
701,83890,Female house shop in Nottinghamshire,house shop,Female,Nottinghamshire,2
702,51020,Female puplican in Nottinghamshire,puplican,Female,Nottinghamshire,1
703,99999,Female butler wife in Nottinghamshire,butler wife,Female,Nottinghamshire,1
704,99999,Female farm laborer wife in Nottinghamshire,farm laborer wife,Female,Nottinghamshire,1
705,99999,Female trained nurse sm in Nottinghamshire,trained nurse sm,Female,Nottinghamshire,1
706,-1,Female grocer hosiery framework knitter daughter in Nottinghamshire,grocer hosiery framework knitter daughter,Female,Nottinghamshire,1
707,14120,Male vicar of langford with holme in Nottinghamshire,vicar of langford with holme,Male,Nottinghamshire,1
708,62711,Male gardiner domestic in Nottinghamshire,gardiner domestic,Male,Nottinghamshire,1
709,62460,Male groom in Nottinghamshire,groom,Male,Nottinghamshire,1
710,61110,Male farmer of acres carpenter in Nottinghamshire,farmer of acres carpenter,Male,Nottinghamshire,1
711,83830,Male printing machine maker em in Nottinghamshire,printing machine maker em,Male,Nottinghamshire,1
712,95410,Male carpenter employing man boys in Nottinghamshire,carpenter employing man boys,Male,Nottinghamshire,1
713,41010,Male boy furniture dealer keeps in Nottinghamshire,boy furniture dealer keeps,Male,Nottinghamshire,1
714,75500,Male manufacturer in Nottinghamshire,manufacturer,Male,Nottinghamshire,1
715,41010,Male cashier clark to draper in Nottinghamshire,cashier clark to draper,Male,Nottinghamshire,1
716,99999,Male retired iron miner in Nottinghamshire,retired iron miner,Male,Nottinghamshire,1
717,41010,Female merchant widow in Oxfordshire,merchant widow,Female,Oxfordshire,3
718,99999,Female sawyer wife in Oxfordshire,sawyer wife,Female,Oxfordshire,2
719,14140,Female proprietor of funds c in Oxfordshire,proprietor of funds c,Female,Oxfordshire,1
720,39900,Female matron school domestic servant in Oxfordshire,matron school domestic servant,Female,Oxfordshire,1
721,54020,Female general servant of workhouse munic in Oxfordshire,general servant of workhouse munic,Female,Oxfordshire,1
722,54020,Female servant in Oxfordshire,servant,Female,Oxfordshire,1
723,79590,Female needlewomam in Oxfordshire,needlewomam,Female,Oxfordshire,1
724,99999,Female pub wife in Oxfordshire,pub wife,Female,Oxfordshire,1
725,99999,Female of mason laborer wife in Oxfordshire,of mason laborer wife,Female,Oxfordshire,1
726,61110,Male farmer out of a farm in Oxfordshire,farmer out of a farm,Male,Oxfordshire,1
727,62110,Male farm servant in doors in Oxfordshire,farm servant in doors,Male,Oxfordshire,1
728,75200,Male woollen weaver cloth manuf in Oxfordshire,woollen weaver cloth manuf,Male,Oxfordshire,1
729,41010,Male drayman in Oxfordshire,drayman,Male,Oxfordshire,1
730,54020,Female formerly a domestic servant in Pembrokeshire,formerly a domestic servant,Female,Pembrokeshire,2
731,41010,Female baker wife in Pembrokeshire,baker wife,Female,Pembrokeshire,2
732,7220,Male army hospital corporal corps in Pembrokeshire,army hospital corporal corps,Male,Pembrokeshire,1
733,33130,Male clerk in bank in Pembrokeshire,clerk in bank,Male,Pembrokeshire,1
734,61110,Male farm holder in Pembrokeshire,farm holder,Male,Pembrokeshire,1
735,61110,Male girl farmer of acres employing servant boys in Pembrokeshire,girl farmer of acres employing servant boys,Male,Pembrokeshire,1
736,62460,Male boy farm servant in Pembrokeshire,boy farm servant,Male,Pembrokeshire,1
737,79590,Female plain sewer in Rutland,plain sewer,Female,Rutland,1
738,62110,Male farm laborer in Rutland,farm laborer,Male,Rutland,1
739,84130,Male railway engine driver in Shropshire,railway engine driver,Male,Shropshire,4
740,61250,Male agricultural labourer in Shropshire,agricultural labourer,Male,Shropshire,2
741,7110,Female nurse in Shropshire,nurse,Female,Shropshire,1
742,61110,Female farmer acres employs men in Shropshire,farmer acres employs men,Female,Shropshire,1
743,61400,Female farm bailiff in Shropshire,farm bailiff,Female,Shropshire,1
744,79320,Female apprentice milliner in Shropshire,apprentice milliner,Female,Shropshire,1
745,24100,Male inspector of waggons railway in Shropshire,inspector of waggons railway,Male,Shropshire,1
746,61110,Male farmer of acers in Shropshire,farmer of acers,Male,Shropshire,1
747,37030,Male postman in Somerset,postman,Male,Somerset,59
748,71120,Male unemployed coal miner in Somerset,unemployed coal miner,Male,Somerset,13
749,99999,Female retired living in means in Somerset,retired living in means,Female,Somerset,2
750,64990,Male gamekeeper domestic domestic servant in Somerset,gamekeeper domestic domestic servant,Male,Somerset,2
751,75200,Male weaver worsted in Somerset,weaver worsted,Male,Somerset,2
752,54010,Female general servant in Somerset,general servant,Female,Somerset,1
753,41010,Female late dairy woman in Somerset,late dairy woman,Female,Somerset,1
754,80390,Female vest maker tj in Somerset,vest maker tj,Female,Somerset,1
755,79590,Female grooms collar works shirt wife in Somerset,grooms collar works shirt wife,Female,Somerset,1
756,99999,Female gas manager wife in Somerset,gas manager wife,Female,Somerset,1
757,58430,Male retired capt royal artillery in Somerset,retired capt royal artillery,Male,Somerset,1
758,2200,Male civil gas engineer in Somerset,civil gas engineer,Male,Somerset,1
759,17120,Male pensioner musician in Somerset,pensioner musician,Male,Somerset,1
760,83210,Male edge tool maker local m proctor in Somerset,edge tool maker local m proctor,Male,Somerset,1
761,74430,Male laborer in matting works in Somerset,laborer in matting works,Male,Somerset,1
762,94290,Male hairdresser in Somerset,hairdresser,Male,Somerset,1
763,77820,Male unemployed brewer in Somerset,unemployed brewer,Male,Somerset,1
764,92600,Male book binder in Staffordshire,book binder,Male,Staffordshire,34
765,94290,Female brush maker in Staffordshire,brush maker,Female,Staffordshire,32
766,41015,Male retired coal merchant in Staffordshire,retired coal merchant,Male,Staffordshire,5
767,72100,Male boy foundry in Staffordshire,boy foundry,Male,Staffordshire,4
768,83400,Male hollowware turner iron in Staffordshire,hollowware turner iron,Male,Staffordshire,4
769,85500,Male miner in Staffordshire,miner,Male,Staffordshire,3
770,79320,Female apprentice milliner in Staffordshire,apprentice milliner,Female,Staffordshire,2
771,83700,Male retired key maker in Staffordshire,retired key maker,Male,Staffordshire,2
772,81120,Female upholsterer in Staffordshire,upholsterer,Female,Staffordshire,1
773,89300,Female brick maker in Staffordshire,brick maker,Female,Staffordshire,1
774,89200,Female painter on earthenware in Staffordshire,painter on earthenware,Female,Staffordshire,1
