record_id,original_hisco,enhanced_input,original_occupation,sex,county,count
775,79400,Female buttoner in Staffordshire,buttoner,Female,Staffordshire,1
776,83400,Female machinist in Staffordshire,machinist,Female,Staffordshire,1
777,99999,Female maltster maker wife in Staffordshire,maltster maker wife,Female,Staffordshire,1
778,44330,Male house agent in Staffordshire,house agent,Male,Staffordshire,1
779,98300,Male locomotive engineer cleaner or in Staffordshire,locomotive engineer cleaner or,Male,Staffordshire,1
780,37040,Male office boy in tramway messenger in Staffordshire,office boy in tramway messenger,Male,Staffordshire,1
781,61110,Male boy farmer acres laborers in Staffordshire,boy farmer acres laborers,Male,Staffordshire,1
782,87330,Male commercial clerk at copper works in Staffordshire,commercial clerk at copper works,Male,Staffordshire,1
783,84190,Male trap manufacturer vermin control man in Staffordshire,trap manufacturer vermin control man,Male,Staffordshire,1
784,83890,Male fetler artz in Staffordshire,fetler artz,Male,Staffordshire,1
785,83890,Male tube finisher in Staffordshire,tube finisher,Male,Staffordshire,1
786,81300,Male rly waggon maker in Staffordshire,rly waggon maker,Male,Staffordshire,1
787,81120,Male cabinet makers foreman in Staffordshire,cabinet makers foreman,Male,Staffordshire,1
788,81230,Male ironworker turner over in Staffordshire,ironworker turner over,Male,Staffordshire,1
789,92110,Male printing machine minder in Staffordshire,printing machine minder,Male,Staffordshire,1
790,41010,Male apprentice draper employee in Staffordshire,apprentice draper employee,Male,Staffordshire,1
791,77650,Male packer in in Staffordshire,packer in,Male,Staffordshire,1
792,92900,Male figure maker cg in Staffordshire,figure maker cg,Male,Staffordshire,1
793,84110,Male unemployed tender moulder in Staffordshire,unemployed tender moulder,Male,Staffordshire,1
794,99999,Female carpenter wife in Suffolk,carpenter wife,Female,Suffolk,98
795,99999,Female brick maker wife in Suffolk,brick maker wife,Female,Suffolk,19
796,51020,Male innkeeper in Suffolk,innkeeper,Male,Suffolk,8
797,17120,Female teacher of music pianist in Suffolk,teacher of music pianist,Female,Suffolk,3
798,98300,Male engine driver in Suffolk,engine driver,Male,Suffolk,3
799,99999,Female paupers in Suffolk,paupers,Female,Suffolk,2
800,61110,Female boy farmer of acres employg men in Suffolk,boy farmer of acres employg men,Female,Suffolk,1
801,41010,Female hand dealer in second clothes in Suffolk,hand dealer in second clothes,Female,Suffolk,1
802,58220,Male superintendent suffolk county police in Suffolk,superintendent suffolk county police,Male,Suffolk,1
803,13200,Male master school certified in Suffolk,master school certified,Male,Suffolk,1
804,81400,Male boy wheelwright publican emp men in Suffolk,boy wheelwright publican emp men,Male,Suffolk,1
805,95120,Male bricklayer in Suffolk,bricklayer,Male,Suffolk,1
806,54020,Female domestic servant in Surrey (Extra London),domestic servant,Female,Surrey (Extra London),46
807,43030,Male news agent in Surrey (Extra London),news agent,Male,Surrey (Extra London),14
808,15100,Male author in Surrey (Extra London),author,Male,Surrey (Extra London),9
809,59990,Male boot maker in Surrey (Extra London),boot maker,Male,Surrey (Extra London),4
810,41010,Male baker man in Surrey (Extra London),baker man,Male,Surrey (Extra London),4
811,13100,Female interest of money and rents of lands in Surrey (Extra London),interest of money and rents of lands,Female,Surrey (Extra London),3
812,54020,Male domestic servant in Surrey (Extra London),domestic servant,Male,Surrey (Extra London),3
813,37040,Male hall porter dom in Surrey (Extra London),hall porter dom,Male,Surrey (Extra London),2
814,84190,Male road labourer in Surrey (Extra London),road labourer,Male,Surrey (Extra London),2
815,53102,Female formely in Surrey (Extra London),formely,Female,Surrey (Extra London),1
816,83150,Female carrier in Surrey (Extra London),carrier,Female,Surrey (Extra London),1
817,99999,Female retired pensioner in Surrey (Extra London),retired pensioner,Female,Surrey (Extra London),1
818,99999,Female surveyor wife in Surrey (Extra London),surveyor wife,Female,Surrey (Extra London),1
819,58420,Male enginer labr e r in Surrey (Extra London),enginer labr e r,Male,Surrey (Extra London),1
820,62110,Male domestic servant in Surrey (Extra London),domestic servant,Male,Surrey (Extra London),1
821,62710,Male gardener in Surrey (Extra London),gardener,Male,Surrey (Extra London),1
822,87350,Male apprentice boiler maker in Surrey (Extra London),apprentice boiler maker,Male,Surrey (Extra London),1
823,87130,Male labr plumbers in Surrey (Extra London),labr plumbers,Male,Surrey (Extra London),1
824,89120,Male assist carrier in Surrey (Extra London),assist carrier,Male,Surrey (Extra London),1
825,75600,Male dyer cleaner in Surrey (Extra London),dyer cleaner,Male,Surrey (Extra London),1
826,89300,Male brick maker in Sussex,brick maker,Male,Sussex,787
827,62110,Female agricultural labourer in Sussex,agricultural labourer,Female,Sussex,5
828,62110,Male stackman in Sussex,stackman,Male,Sussex,2
829,62110,Female farm domestic servant indoor agricultural labourer in Sussex,farm domestic servant indoor agricultural labourer,Female,Sussex,1
830,79540,Female embroidery in Sussex,embroidery,Female,Sussex,1
831,41010,Female assistant stationer confectioner in Sussex,assistant stationer confectioner,Female,Sussex,1
832,99999,Female wheelwright wife in Sussex,wheelwright wife,Female,Sussex,1
833,99999,Female farmer widow in Sussex,farmer widow,Female,Sussex,1
834,6100,Male surgeon general practitioner in Sussex,surgeon general practitioner,Male,Sussex,1
835,13100,Male professor of elocution in Sussex,professor of elocution,Male,Sussex,1
836,13100,Male professor of experimental physics in Sussex,professor of experimental physics,Male,Sussex,1
837,17120,Male teacher pianoforte music in Sussex,teacher pianoforte music,Male,Sussex,1
838,98130,Male boatman in Sussex,boatman,Male,Sussex,1
839,37040,Male boy errand boy in Sussex,boy errand boy,Male,Sussex,1
840,83120,Male smith b in Sussex,smith b,Male,Sussex,1
841,85100,Male late in revenu excise offices in Sussex,late in revenu excise offices,Male,Sussex,1
842,81300,Male apprentice coachmaker painters in Sussex,apprentice coachmaker painters,Male,Sussex,1
843,97490,Male urban suss authy road labourer in Sussex,urban suss authy road labourer,Male,Sussex,1
844,92120,Male printer compositor machine foreman in Sussex,printer compositor machine foreman,Male,Sussex,1
845,80100,Male assistant boot and shoe maker in Sussex,assistant boot and shoe maker,Male,Sussex,1
846,83120,Female blacksmith in Warwickshire,blacksmith,Female,Warwickshire,9
847,77840,Male mineral water maker in Warwickshire,mineral water maker,Male,Warwickshire,9
848,94990,Female pearl grinder in Warwickshire,pearl grinder,Female,Warwickshire,8
849,83890,Male brass tube solderer in Warwickshire,brass tube solderer,Male,Warwickshire,7
850,83160,Female machine maker in Warwickshire,machine maker,Female,Warwickshire,5
851,99999,Female iron moulder wife in Warwickshire,iron moulder wife,Female,Warwickshire,5
852,83890,Male unemployed bedstead maker in Warwickshire,unemployed bedstead maker,Male,Warwickshire,4
853,83890,Female wood screw woman in Warwickshire,wood screw woman,Female,Warwickshire,2
854,61110,Female boy employing men in Warwickshire,boy employing men,Female,Warwickshire,1
855,83890,Female warehouse woman pin maker in Warwickshire,warehouse woman pin maker,Female,Warwickshire,1
856,99999,Female glass etchers wife in Warwickshire,glass etchers wife,Female,Warwickshire,1
857,99999,Female miller corn merchants wife in Warwickshire,miller corn merchants wife,Female,Warwickshire,1
858,14120,Male late vicar of chilvers coton warwickshire in Warwickshire,late vicar of chilvers coton warwickshire,Male,Warwickshire,1
859,14120,Male vicar of st marys leamington in Warwickshire,vicar of st marys leamington,Male,Warwickshire,1
860,98430,Male pointman in Warwickshire,pointman,Male,Warwickshire,1
861,72400,Male iron founder in Warwickshire,iron founder,Male,Warwickshire,1
862,83210,Male tool maker and tobacconist in Warwickshire,tool maker and tobacconist,Male,Warwickshire,1
863,83860,Male wirespring mattress maker in Warwickshire,wirespring mattress maker,Male,Warwickshire,1
864,88040,Male silversmith goldsmith cutter out of employ in Warwickshire,silversmith goldsmith cutter out of employ,Male,Warwickshire,1
865,81300,Male retired coachmaker builder in Warwickshire,retired coachmaker builder,Male,Warwickshire,1
866,84220,Male boy watch dial maker employing men in Warwickshire,boy watch dial maker employing men,Male,Warwickshire,1
867,87130,Male master plumber glazier painter employing men in Warwickshire,master plumber glazier painter employing men,Male,Warwickshire,1
868,41010,Male retired druggist in Warwickshire,retired druggist,Male,Warwickshire,1
869,75990,Male ribbon weaver fisherman shop in Warwickshire,ribbon weaver fisherman shop,Male,Warwickshire,1
870,99999,Male son in Warwickshire,son,Male,Warwickshire,1
871,76140,Male tanner in Westmorland,tanner,Male,Westmorland,9
872,61400,Male ser farm indoor in Westmorland,ser farm indoor,Male,Westmorland,2
873,63110,Male forester wd man in Westmorland,forester wd man,Male,Westmorland,2
874,62110,Female servant farm indoor agricultural labourer in Westmorland,servant farm indoor agricultural labourer,Female,Westmorland,1
875,-1,Female legalte in Westmorland,legalte,Female,Westmorland,1
876,37040,Male queens porter messenger in Westmorland,queens porter messenger,Male,Westmorland,1
877,80390,Male skewer maker in Westmorland,skewer maker,Male,Westmorland,1
878,62110,Male agricultural labourer in Wiltshire,agricultural labourer,Male,Wiltshire,87
879,54020,Female domestic servant in Wiltshire,domestic servant,Female,Wiltshire,8
880,17120,Female organist in Wiltshire,organist,Female,Wiltshire,5
881,99999,Female fishmonger wife in Wiltshire,fishmonger wife,Female,Wiltshire,4
882,2100,Female assistant to dress making in Wiltshire,assistant to dress making,Female,Wiltshire,1
883,62710,Female road labourer in Wiltshire,road labourer,Female,Wiltshire,1
884,31090,Male workhouse labour supervisor in Wiltshire,workhouse labour supervisor,Male,Wiltshire,1
885,14120,Male rector of fittleton in Wiltshire,rector of fittleton,Male,Wiltshire,1
886,17120,Male master band sergt r wilts and in Wiltshire,master band sergt r wilts and,Male,Wiltshire,1
887,62460,Male lodging house keeper in Wiltshire,lodging house keeper,Male,Wiltshire,1
888,61110,Male farmer of acres employing men boys in Wiltshire,farmer of acres employing men boys,Male,Wiltshire,1
889,62110,Male employed agricultural labourer in Wiltshire,employed agricultural labourer,Male,Wiltshire,1
890,87330,Male grazier in Wiltshire,grazier,Male,Wiltshire,1
891,83890,Male labourer at parchment works in Wiltshire,labourer at parchment works,Male,Wiltshire,1
892,83230,Female glouemaker in Worcestershire,glouemaker,Female,Worcestershire,3
893,85100,Female works in earthenware factory in Worcestershire,works in earthenware factory,Female,Worcestershire,1
894,99999,Female of of family wife in Worcestershire,of of family wife,Female,Worcestershire,1
895,99999,Female analytical manufs chemist fcs wife in Worcestershire,analytical manufs chemist fcs wife,Female,Worcestershire,1
896,20100,Male member of st georges guild in Worcestershire,member of st georges guild,Male,Worcestershire,1
897,58500,Male out of business in Worcestershire,out of business,Male,Worcestershire,1
898,98550,Male mail carter driver carter in Worcestershire,mail carter driver carter,Male,Worcestershire,1
899,61110,Male boy farmer acres employing men in Worcestershire,boy farmer acres employing men,Male,Worcestershire,1
900,94940,Male clerk steel toy works in Worcestershire,clerk steel toy works,Male,Worcestershire,1
901,94990,Male pipe finisher tobacco in Worcestershire,pipe finisher tobacco,Male,Worcestershire,1
902,99150,Male apprentice hop mart in Worcestershire,apprentice hop mart,Male,Worcestershire,1
903,54020,Female domestic servant laundry maid in Yorkshire East Riding (With ,domestic servant laundry maid,Female,Yorkshire East Riding (With ,6
904,72400,Male laborer iron works in Yorkshire East Riding (With ,laborer iron works,Male,Yorkshire East Riding (With ,6
905,54020,Female kitchenmaid domestic domestic servant in Yorkshire East Riding (With ,kitchenmaid domestic domestic servant,Female,Yorkshire East Riding (With ,3
906,62420,Female dairy maid ind farm in Yorkshire East Riding (With ,dairy maid ind farm,Female,Yorkshire East Riding (With ,1
907,62110,Female servant farm dom in Yorkshire East Riding (With ,servant farm dom,Female,Yorkshire East Riding (With ,1
908,99999,Female wool broker wife in Yorkshire East Riding (With ,wool broker wife,Female,Yorkshire East Riding (With ,1
909,99999,Female gas house stokers wife in Yorkshire East Riding (With ,gas house stokers wife,Female,Yorkshire East Riding (With ,1
910,54020,Male butlers servant domestic in Yorkshire East Riding (With ,butlers servant domestic,Male,Yorkshire East Riding (With ,1
911,98430,Male boy railway gate points in Yorkshire East Riding (With ,boy railway gate points,Male,Yorkshire East Riding (With ,1
912,62110,Male farm servant in Yorkshire East Riding (With ,farm servant,Male,Yorkshire East Riding (With ,1
913,87350,Male boiler maker shipyard in Yorkshire East Riding (With ,boiler maker shipyard,Male,Yorkshire East Riding (With ,1
914,83210,Male goldsmith in Yorkshire East Riding (With ,goldsmith,Male,Yorkshire East Riding (With ,1
915,81300,Male apprentice to carriage maker rly in Yorkshire East Riding (With ,apprentice to carriage maker rly,Male,Yorkshire East Riding (With ,1
916,99999,Male gentleman annuitant in Yorkshire East Riding (With ,gentleman annuitant,Male,Yorkshire East Riding (With ,1
917,99999,Male parish pay in Yorkshire East Riding (With ,parish pay,Male,Yorkshire East Riding (With ,1
918,-1,Male confectioner in Yorkshire East Riding (With ,confectioner,Male,Yorkshire East Riding (With ,1
919,99999,Female boiler maker wife in Yorkshire North Riding,boiler maker wife,Female,Yorkshire North Riding,7
920,72400,Male laborer iron foundry in Yorkshire North Riding,laborer iron foundry,Male,Yorkshire North Riding,4
921,63110,Male woodmans labourer in Yorkshire North Riding,woodmans labourer,Male,Yorkshire North Riding,3
922,58420,Male inspecting engines em in Yorkshire North Riding,inspecting engines em,Male,Yorkshire North Riding,2
923,14130,Female female missionary in Yorkshire North Riding,female missionary,Female,Yorkshire North Riding,1
924,54020,Female kitchenmaid domestic servant in Yorkshire North Riding,kitchenmaid domestic servant,Female,Yorkshire North Riding,1
925,51040,Female shopkeeper in Yorkshire North Riding,shopkeeper,Female,Yorkshire North Riding,1
926,54020,Male general servant indoor farm in Yorkshire North Riding,general servant indoor farm,Male,Yorkshire North Riding,1
927,62110,Male agricultural labourer agricultural labourer indoor in Yorkshire North Riding,agricultural labourer agricultural labourer indoor,Male,Yorkshire North Riding,1
928,62110,Male farm laborer in Yorkshire North Riding,farm laborer,Male,Yorkshire North Riding,1
929,83120,Male licenced victualler and blacksmith in Yorkshire North Riding,licenced victualler and blacksmith,Male,Yorkshire North Riding,1
930,87590,Male shipwright in Yorkshire North Riding,shipwright,Male,Yorkshire North Riding,1
931,96900,Male hauling engine man in Yorkshire North Riding,hauling engine man,Male,Yorkshire North Riding,1
932,99999,Male retired house proprietor in Yorkshire North Riding,retired house proprietor,Male,Yorkshire North Riding,1
933,54020,Female general domestic in Yorkshire West Riding,general domestic,Female,Yorkshire West Riding,176
934,75200,Male cotton warp dresser in Yorkshire West Riding,cotton warp dresser,Male,Yorkshire West Riding,36
935,79990,Female cotton minder in Yorkshire West Riding,cotton minder,Female,Yorkshire West Riding,19
936,73300,Male labourer at paper miller in Yorkshire West Riding,labourer at paper miller,Male,Yorkshire West Riding,17
937,61400,Male farm bailiff in Yorkshire West Riding,farm bailiff,Male,Yorkshire West Riding,8
938,75100,Male teazer woollen in Yorkshire West Riding,teazer woollen,Male,Yorkshire West Riding,6
939,75000,Male worsted weft manager in Yorkshire West Riding,worsted weft manager,Male,Yorkshire West Riding,5
940,7110,Female nurse s m in Yorkshire West Riding,nurse s m,Female,Yorkshire West Riding,3
941,41010,Female beershop keeper in Yorkshire West Riding,beershop keeper,Female,Yorkshire West Riding,2
942,44330,Male land drainage in Yorkshire West Riding,land drainage,Male,Yorkshire West Riding,2
943,33130,Male cashier bank in Yorkshire West Riding,cashier bank,Male,Yorkshire West Riding,2
944,98300,Male locomotive engine fireman in Yorkshire West Riding,locomotive engine fireman,Male,Yorkshire West Riding,2
945,84190,Male apprentice fitter printing machine works in Yorkshire West Riding,apprentice fitter printing machine works,Male,Yorkshire West Riding,2
946,95410,Male apprentice joiner builder in Yorkshire West Riding,apprentice joiner builder,Male,Yorkshire West Riding,2
947,75000,Male worsted genappe mohair overlooker in Yorkshire West Riding,worsted genappe mohair overlooker,Male,Yorkshire West Riding,2
948,7220,Female formerly sick nurse in Yorkshire West Riding,formerly sick nurse,Female,Yorkshire West Riding,1
949,13200,Female teacher history mathematics school in Yorkshire West Riding,teacher history mathematics school,Female,Yorkshire West Riding,1
950,54020,Female stillroom maid domes domestic servant domestic in Yorkshire West Riding,stillroom maid domes domestic servant domestic,Female,Yorkshire West Riding,1
951,4290,Female lockkeeper in Yorkshire West Riding,lockkeeper,Female,Yorkshire West Riding,1
952,3200,Female assistant ger in Yorkshire West Riding,assistant ger,Female,Yorkshire West Riding,1
953,89200,Female potter earthenware in Yorkshire West Riding,potter earthenware,Female,Yorkshire West Riding,1
954,75400,Female weaver when working cloth in Yorkshire West Riding,weaver when working cloth,Female,Yorkshire West Riding,1
955,75200,Female cloth weaver in Yorkshire West Riding,cloth weaver,Female,Yorkshire West Riding,1
956,92800,Female woollen number in Yorkshire West Riding,woollen number,Female,Yorkshire West Riding,1
957,41010,Female apprentice confectioner in Yorkshire West Riding,apprentice confectioner,Female,Yorkshire West Riding,1
958,78100,Female apprentice cigar in Yorkshire West Riding,apprentice cigar,Female,Yorkshire West Riding,1
959,99999,Female engineer printing machine wife in Yorkshire West Riding,engineer printing machine wife,Female,Yorkshire West Riding,1
960,99999,Female surgical instrument maker wife in Yorkshire West Riding,surgical instrument maker wife,Female,Yorkshire West Riding,1
961,99999,Female umbrella foreman wife in Yorkshire West Riding,umbrella foreman wife,Female,Yorkshire West Riding,1
962,99999,Female agricultural labourer widow in Yorkshire West Riding,agricultural labourer widow,Female,Yorkshire West Riding,1
963,37020,Male servant in chemists office in Yorkshire West Riding,servant in chemists office,Male,Yorkshire West Riding,1
964,11010,Male chartered accountant emplg clerk in Yorkshire West Riding,chartered accountant emplg clerk,Male,Yorkshire West Riding,1
965,44330,Male retired land agent in Yorkshire West Riding,retired land agent,Male,Yorkshire West Riding,1
966,44120,Male insurance clerk musician in Yorkshire West Riding,insurance clerk musician,Male,Yorkshire West Riding,1
967,98300,Male engine makers foreman in Yorkshire West Riding,engine makers foreman,Male,Yorkshire West Riding,1
968,98300,Male locomotive driver in Yorkshire West Riding,locomotive driver,Male,Yorkshire West Riding,1
969,97130,Male foreman porter rly in Yorkshire West Riding,foreman porter rly,Male,Yorkshire West Riding,1
970,97190,Male coal shipper navy domestic servant in Yorkshire West Riding,coal shipper navy domestic servant,Male,Yorkshire West Riding,1
971,37040,Male boy errand at factory in Yorkshire West Riding,boy errand at factory,Male,Yorkshire West Riding,1
972,61110,Male farmer acres in Yorkshire West Riding,farmer acres,Male,Yorkshire West Riding,1
973,61110,Male farmer of acres joiner grocer in Yorkshire West Riding,farmer of acres joiner grocer,Male,Yorkshire West Riding,1
974,62110,Male journeyman agricultural labourer in Yorkshire West Riding,journeyman agricultural labourer,Male,Yorkshire West Riding,1
975,21140,Male colliery mine domestic servant in Yorkshire West Riding,colliery mine domestic servant,Male,Yorkshire West Riding,1
976,22130,Male boy quarry half timer in Yorkshire West Riding,boy quarry half timer,Male,Yorkshire West Riding,1
977,41015,Male stone merchant employing men in Yorkshire West Riding,stone merchant employing men,Male,Yorkshire West Riding,1
978,83400,Male steam hamer driver iron in Yorkshire West Riding,steam hamer driver iron,Male,Yorkshire West Riding,1
979,83160,Male heater for file maker in Yorkshire West Riding,heater for file maker,Male,Yorkshire West Riding,1
980,83890,Male gas engineer gas in Yorkshire West Riding,gas engineer gas,Male,Yorkshire West Riding,1
981,81300,Male apprentice carriage trimmers in Yorkshire West Riding,apprentice carriage trimmers,Male,Yorkshire West Riding,1
982,41010,Male bricklayer fitter in Yorkshire West Riding,bricklayer fitter,Male,Yorkshire West Riding,1
983,75200,Male worsted spinner in Yorkshire West Riding,worsted spinner,Male,Yorkshire West Riding,1
984,75200,Male ward dresser foreman worsted in Yorkshire West Riding,ward dresser foreman worsted,Male,Yorkshire West Riding,1
985,75000,Male cloth boiler wool in Yorkshire West Riding,cloth boiler wool,Male,Yorkshire West Riding,1
986,75000,Male foreman woolen miller in Yorkshire West Riding,foreman woolen miller,Male,Yorkshire West Riding,1
987,75000,Male wool combing overlooker w cloth in Yorkshire West Riding,wool combing overlooker w cloth,Male,Yorkshire West Riding,1
988,75000,Male worsted drawing overlooker text in Yorkshire West Riding,worsted drawing overlooker text,Male,Yorkshire West Riding,1
989,75600,Male dyer cloth finisher wool in Yorkshire West Riding,dyer cloth finisher wool,Male,Yorkshire West Riding,1
990,41010,Male assistant shopman grocer in Yorkshire West Riding,assistant shopman grocer,Male,Yorkshire West Riding,1
991,77830,Male malster laborer in Yorkshire West Riding,malster laborer,Male,Yorkshire West Riding,1
992,41010,Male flour horse shop in Yorkshire West Riding,flour horse shop,Male,Yorkshire West Riding,1
993,96900,Male unemployed engine maker in Yorkshire West Riding,unemployed engine maker,Male,Yorkshire West Riding,1
994,99150,Male apprentice draping in Yorkshire West Riding,apprentice draping,Male,Yorkshire West Riding,1
995,99999,Male gentleman independent in Yorkshire West Riding,gentleman independent,Male,Yorkshire West Riding,1
996,99999,Male late no occupation signalman on ry mrssy in Yorkshire West Riding,late no occupation signalman on ry mrssy,Male,Yorkshire West Riding,1
